{
    "parameters": {
        "service": "megafrobber",
        "hosts": [
            "host01.example.com"
        ],
        "subcommand": "Restart",
        "command": "service",
        "tries": 5,
        "check_scripts": ["doesitwork"]
    },
    "group": "test",
    "dynamic": {},
    "notify": {}
}
